{
 "generated_at": "2026-10-11T17:57:38+00:00",
 "seed": 20261011,
 "n_launches": 200,
 "target_coverage": 0.9,
 "arms": [
  {
   "id": "new_city",
   "label": "New city",
   "kind": "new_city",
   "assumptions_hold": true,
   "by_week": [
    {
     "week": 1,
     "coverage_total": 0.905,
     "coverage_total_mcse": 0.0207,
     "coverage_unknown": 0.905,
     "mean_width_total": 2943.57,
     "median_width_total": 2693.61,
     "bias_total": -11.81,
     "rmse_total": 950.32,
     "refit_rate": 0.025,
     "mean_ess": 1172.9,
     "mean_pareto_k": -0.0729,
     "n": 200
    },
    {
     "week": 2,
     "coverage_total": 0.91,
     "coverage_total_mcse": 0.0202,
     "coverage_unknown": 0.925,
     "mean_width_total": 2391.47,
     "median_width_total": 2116.97,
     "bias_total": 0.42,
     "rmse_total": 724.11,
     "refit_rate": 0.035,
     "mean_ess": 932.7,
     "mean_pareto_k": 0.0951,
     "n": 200
    },
    {
     "week": 3,
     "coverage_total": 0.905,
     "coverage_total_mcse": 0.0207,
     "coverage_unknown": 0.94,
     "mean_width_total": 1894.27,
     "median_width_total": 1773.62,
     "bias_total": -6.92,
     "rmse_total": 745.44,
     "refit_rate": 0.04,
     "mean_ess": 843.6,
     "mean_pareto_k": 0.2959,
     "n": 200
    },
    {
     "week": 4,
     "coverage_total": 0.92,
     "coverage_total_mcse": 0.0192,
     "coverage_unknown": 0.905,
     "mean_width_total": 1738.35,
     "median_width_total": 1600.38,
     "bias_total": -29.41,
     "rmse_total": 558.44,
     "refit_rate": 0.05,
     "mean_ess": 753.1,
     "mean_pareto_k": 0.3832,
     "n": 200
    },
    {
     "week": 5,
     "coverage_total": 0.925,
     "coverage_total_mcse": 0.0186,
     "coverage_unknown": 0.92,
     "mean_width_total": 1681.68,
     "median_width_total": 1441.37,
     "bias_total": -66.09,
     "rmse_total": 1006.19,
     "refit_rate": 0.055,
     "mean_ess": 698.9,
     "mean_pareto_k": 0.5432,
     "n": 200
    },
    {
     "week": 6,
     "coverage_total": 0.93,
     "coverage_total_mcse": 0.018,
     "coverage_unknown": 0.935,
     "mean_width_total": 1408.64,
     "median_width_total": 1327.97,
     "bias_total": -17.23,
     "rmse_total": 501.64,
     "refit_rate": 0.055,
     "mean_ess": 638.7,
     "mean_pareto_k": 0.7583,
     "n": 200
    },
    {
     "week": 7,
     "coverage_total": 0.93,
     "coverage_total_mcse": 0.018,
     "coverage_unknown": 0.925,
     "mean_width_total": 1371.94,
     "median_width_total": 1246.78,
     "bias_total": -12.3,
     "rmse_total": 594.92,
     "refit_rate": 0.065,
     "mean_ess": 593.1,
     "mean_pareto_k": 0.7677,
     "n": 200
    },
    {
     "week": 8,
     "coverage_total": 0.935,
     "coverage_total_mcse": 0.0174,
     "coverage_unknown": 0.92,
     "mean_width_total": 1299.64,
     "median_width_total": 1160.46,
     "bias_total": -9.69,
     "rmse_total": 394.87,
     "refit_rate": 0.07,
     "mean_ess": 559.4,
     "mean_pareto_k": 1.2311,
     "n": 200
    }
   ],
   "verdict": "Coverage stays within 4 points of 90% across all 8 weeks (closest 1 points), and the 90% interval narrows 56% from week 1 to week 8."
  },
  {
   "id": "feature",
   "label": "New feature",
   "kind": "feature",
   "assumptions_hold": true,
   "by_week": [
    {
     "week": 1,
     "coverage_total": 0.905,
     "coverage_total_mcse": 0.0207,
     "coverage_unknown": 0.895,
     "mean_width_total": 1725.39,
     "median_width_total": 1697.41,
     "bias_total": -79.36,
     "rmse_total": 542.14,
     "refit_rate": 0.0,
     "mean_ess": 1151.8,
     "mean_pareto_k": -0.2102,
     "n": 200
    },
    {
     "week": 2,
     "coverage_total": 0.9,
     "coverage_total_mcse": 0.0212,
     "coverage_unknown": 0.895,
     "mean_width_total": 1386.7,
     "median_width_total": 1382.46,
     "bias_total": -0.56,
     "rmse_total": 433.03,
     "refit_rate": 0.0,
     "mean_ess": 942.5,
     "mean_pareto_k": -0.1889,
     "n": 200
    },
    {
     "week": 3,
     "coverage_total": 0.89,
     "coverage_total_mcse": 0.0221,
     "coverage_unknown": 0.875,
     "mean_width_total": 1180.74,
     "median_width_total": 1150.47,
     "bias_total": 15.18,
     "rmse_total": 374.68,
     "refit_rate": 0.0,
     "mean_ess": 803.0,
     "mean_pareto_k": -0.1954,
     "n": 200
    },
    {
     "week": 4,
     "coverage_total": 0.915,
     "coverage_total_mcse": 0.0197,
     "coverage_unknown": 0.9,
     "mean_width_total": 1043.22,
     "median_width_total": 1005.07,
     "bias_total": 9.42,
     "rmse_total": 327.94,
     "refit_rate": 0.0,
     "mean_ess": 713.4,
     "mean_pareto_k": -0.1791,
     "n": 200
    },
    {
     "week": 5,
     "coverage_total": 0.875,
     "coverage_total_mcse": 0.0234,
     "coverage_unknown": 0.875,
     "mean_width_total": 942.32,
     "median_width_total": 940.55,
     "bias_total": 6.71,
     "rmse_total": 296.04,
     "refit_rate": 0.005,
     "mean_ess": 647.0,
     "mean_pareto_k": -0.1684,
     "n": 200
    },
    {
     "week": 6,
     "coverage_total": 0.885,
     "coverage_total_mcse": 0.0226,
     "coverage_unknown": 0.885,
     "mean_width_total": 872.89,
     "median_width_total": 857.2,
     "bias_total": 4.24,
     "rmse_total": 271.89,
     "refit_rate": 0.005,
     "mean_ess": 575.6,
     "mean_pareto_k": -0.1643,
     "n": 200
    },
    {
     "week": 7,
     "coverage_total": 0.895,
     "coverage_total_mcse": 0.0217,
     "coverage_unknown": 0.89,
     "mean_width_total": 810.31,
     "median_width_total": 798.19,
     "bias_total": -5.34,
     "rmse_total": 239.84,
     "refit_rate": 0.01,
     "mean_ess": 531.8,
     "mean_pareto_k": -0.15,
     "n": 200
    },
    {
     "week": 8,
     "coverage_total": 0.92,
     "coverage_total_mcse": 0.0192,
     "coverage_unknown": 0.935,
     "mean_width_total": 761.09,
     "median_width_total": 766.06,
     "bias_total": 9.64,
     "rmse_total": 222.86,
     "refit_rate": 0.015,
     "mean_ess": 497.1,
     "mean_pareto_k": -0.1189,
     "n": 200
    }
   ],
   "verdict": "Coverage stays within 3 points of 90% across all 8 weeks (closest 0 points), and the 90% interval narrows 56% from week 1 to week 8."
  },
  {
   "id": "feature_rampup",
   "label": "New feature with a ramp-up (assumption broken)",
   "kind": "feature",
   "assumptions_hold": false,
   "by_week": [
    {
     "week": 1,
     "coverage_total": 0.285,
     "coverage_total_mcse": 0.0319,
     "coverage_unknown": 0.095,
     "mean_width_total": 1175.04,
     "median_width_total": 1164.62,
     "bias_total": -969.52,
     "rmse_total": 1122.29,
     "refit_rate": 0.335,
     "mean_ess": 203.1,
     "mean_pareto_k": 0.3898,
     "n": 200
    },
    {
     "week": 2,
     "coverage_total": 0.09,
     "coverage_total_mcse": 0.0202,
     "coverage_unknown": 0.0,
     "mean_width_total": 983.05,
     "median_width_total": 1062.99,
     "bias_total": -1039.64,
     "rmse_total": 1121.71,
     "refit_rate": 0.42,
     "mean_ess": 224.3,
     "mean_pareto_k": 0.5942,
     "n": 200
    },
    {
     "week": 3,
     "coverage_total": 0.06,
     "coverage_total_mcse": 0.0168,
     "coverage_unknown": 0.0,
     "mean_width_total": 844.67,
     "median_width_total": 914.62,
     "bias_total": -881.59,
     "rmse_total": 947.87,
     "refit_rate": 0.34,
     "mean_ess": 271.1,
     "mean_pareto_k": 0.5946,
     "n": 200
    },
    {
     "week": 4,
     "coverage_total": 0.155,
     "coverage_total_mcse": 0.0256,
     "coverage_unknown": 0.0,
     "mean_width_total": 801.31,
     "median_width_total": 836.18,
     "bias_total": -706.42,
     "rmse_total": 771.84,
     "refit_rate": 0.285,
     "mean_ess": 297.9,
     "mean_pareto_k": 0.6524,
     "n": 200
    },
    {
     "week": 5,
     "coverage_total": 0.275,
     "coverage_total_mcse": 0.0316,
     "coverage_unknown": 0.0,
     "mean_width_total": 737.48,
     "median_width_total": 764.97,
     "bias_total": -556.66,
     "rmse_total": 615.55,
     "refit_rate": 0.25,
     "mean_ess": 334.7,
     "mean_pareto_k": 0.5792,
     "n": 200
    },
    {
     "week": 6,
     "coverage_total": 0.335,
     "coverage_total_mcse": 0.0334,
     "coverage_unknown": 0.015,
     "mean_width_total": 700.27,
     "median_width_total": 702.08,
     "bias_total": -445.97,
     "rmse_total": 502.86,
     "refit_rate": 0.19,
     "mean_ess": 343.0,
     "mean_pareto_k": 0.473,
     "n": 200
    },
    {
     "week": 7,
     "coverage_total": 0.495,
     "coverage_total_mcse": 0.0354,
     "coverage_unknown": 0.02,
     "mean_width_total": 682.97,
     "median_width_total": 675.41,
     "bias_total": -331.5,
     "rmse_total": 397.79,
     "refit_rate": 0.165,
     "mean_ess": 339.9,
     "mean_pareto_k": 0.4849,
     "n": 200
    },
    {
     "week": 8,
     "coverage_total": 0.69,
     "coverage_total_mcse": 0.0327,
     "coverage_unknown": 0.05,
     "mean_width_total": 652.08,
     "median_width_total": 648.74,
     "bias_total": -235.92,
     "rmse_total": 314.86,
     "refit_rate": 0.135,
     "mean_ess": 324.0,
     "mean_pareto_k": 0.4167,
     "n": 200
    }
   ],
   "verdict": "With the ramp-up the model does not have, coverage falls to 6% against a target of 90%. This is the failure mode to watch for: a launch that builds slowly looks like a weak launch to Ripple.",
   "broken_assumption": "the launch ramps up over the first weeks, which the model has no term for"
  }
 ],
 "headline": "Across 200 synthetic launches per arm, the 90% interval covers the true 12-week total at least 88% of the time when the assumptions hold. Break one assumption \u2014 a launch that ramps up \u2014 and coverage drops to 6%, which is the limit we want you to know about.",
 "runtime_seconds": 28.0
}
